TransactionNo,Date,ProductNo,ProductName,Price,Quantity,CustomerNo,Country
C571507,10/17/2019,16169E,Wrap 50'S Christmas,10.68,-25,13919.0,Denmark
C571507,10/17/2019,23511,Embroidered Ribbon Reel Emily,12.38,-5,13919.0,Denmark
C571507,10/17/2019,22961,Jam Making Set Printed,11.74,-2,13919.0,Denmark
C571507,10/17/2019,21731,Red Toadstool Led Night Light,11.94,-3,13919.0,Denmark
C571507,10/17/2019,22666,Recipe Box Pantry Yellow Design,13.27,-2,13919.0,Denmark
C562728,8/9/2019,22849,Bread Bin Diner Style Mint,25.57,-1,12406.0,Denmark
C562728,8/9/2019,22848,Bread Bin Diner Style Pink,25.57,-4,12406.0,Denmark
C562728,8/9/2019,22846,Bread Bin Diner Style Red,25.57,-4,12406.0,Denmark
